{
  "schemaVersion": "1.0",
  "catalogType": "books",
  "generatedAt": "2026-08-31T23:00:00Z",
  "items": [
    {
      "id": "book-parable-of-the-sower",
      "title": "Parable of the Sower",
      "authors": [
        "Octavia E. Butler"
      ],
      "publicationYear": 1993,
      "summary": "In a near-future California strained by ecological disruption and social breakdown, Lauren Olamina travels north with other survivors while shaping Earthseed, a belief system centered on purposeful change. The novel makes mutual care, practical preparation, and imagination central to survival.",
      "subjects": [
        "Dystopian fiction",
        "Speculative fiction",
        "Climate fiction",
        "African American fiction"
      ],
      "themes": [
        {
          "theme": "ADAPTATION",
          "explanation": "Lauren responds to a changing environment by learning, planning, and revising her path rather than waiting for stability to return.",
          "sourceIds": [
            "src-parable-sower"
          ],
          "experienceIdeas": [
            "Invite guests to name one skill that helps a community adapt.",
            "Offer a make-your-own spice blend station that rewards experimentation."
          ]
        },
        {
          "theme": "COMMUNITY",
          "explanation": "The journey foregrounds cooperation among people who gradually choose shared responsibility over isolation.",
          "sourceIds": [
            "src-parable-sower"
          ],
          "experienceIdeas": [
            "Serve dishes family-style and rotate the role of describing each course.",
            "Create a shared table card where guests add one act of care."
          ]
        },
        {
          "theme": "RESILIENCE",
          "explanation": "The book treats resilience as collective practice: securing food, safety, trust, and a reason to continue.",
          "sourceIds": [
            "src-parable-sower"
          ],
          "experienceIdeas": [
            "Build a menu around pantry staples transformed through patient cooking."
          ]
        },
        {
          "theme": "CHANGE",
          "explanation": "Earthseed frames change as an active force to shape, giving the dinner an opening to discuss how values guide action.",
          "sourceIds": [
            "src-parable-sower"
          ],
          "experienceIdeas": [
            "Use a prompt card: What change would you tend together?"
          ]
        },
        {
          "theme": "IMAGINED_FUTURES",
          "explanation": "The novel joins urgent material conditions to a future-facing spiritual and social vision.",
          "sourceIds": [
            "src-parable-sower"
          ],
          "experienceIdeas": [
            "End the meal with guests sketching a hopeful neighborhood ritual."
          ]
        },
        {
          "theme": "CLIMATE",
          "explanation": "Its California setting connects environmental instability with housing, water, mobility, and public safety.",
          "sourceIds": [
            "src-parable-sower"
          ],
          "experienceIdeas": [
            "Highlight seasonal produce and discuss one local climate-aware food choice."
          ]
        }
      ],
      "copyright": {
        "status": "COPYRIGHTED",
        "mayStoreFullText": false,
        "rightsNote": "In-copyright work. Store bibliographic metadata and original commentary only; do not store full text, cover art, or lengthy excerpts without permission."
      },
      "isbns": {
        "isbn13": "9780941423991"
      },
      "externalIds": {
        "openLibraryWorkId": "OL35623W",
        "googleBooksVolumeId": "dva3QgAACAAJ"
      },
      "links": [
        {
          "kind": "METADATA",
          "url": "https://openlibrary.org/works/OL35623W/Parable_of_the_Sower",
          "label": "Open Library record"
        }
      ],
      "sourceRefs": [
        {
          "sourceId": "src-parable-sower",
          "provider": "Open Library",
          "title": "Parable of the Sower by Octavia E. Butler",
          "url": "https://openlibrary.org/works/OL35623W/Parable_of_the_Sower",
          "accessedAt": "2026-08-31T17:43:05Z",
          "attribution": "Bibliographic and context source; summary and theme notes are original.",
          "licenseNote": "Do not assume the listing grants full-text or cover-image reuse rights."
        }
      ],
      "reviewStatus": "DRAFT",
      "reviewNotes": "Primary work. A human should review thematic framing before publication."
    },
    {
      "id": "book-parable-of-the-talents",
      "title": "Parable of the Talents",
      "authors": [
        "Octavia E. Butler"
      ],
      "publicationYear": 1998,
      "summary": "The sequel returns to an Earthseed community tested by authoritarian politics, religious extremism, and the difficulty of preserving a shared vision. Its documentary structure asks how memory, testimony, and leadership endure under pressure.",
      "subjects": [
        "Dystopian fiction",
        "Speculative fiction",
        "Political fiction",
        "African American fiction"
      ],
      "themes": [
        {
          "theme": "COMMUNITY",
          "explanation": "The narrative examines how an intentional community holds together when its members face coercion and separation.",
          "sourceIds": [
            "src-parable-talents"
          ],
          "experienceIdeas": [
            "Begin with a shared agreement about listening across differences."
          ]
        },
        {
          "theme": "RESILIENCE",
          "explanation": "Survival is presented not as individual toughness but as continued commitments to care, memory, and rebuilding.",
          "sourceIds": [
            "src-parable-talents"
          ],
          "experienceIdeas": [
            "Pair a slow-cooked main with a conversation about what sustains long projects."
          ]
        },
        {
          "theme": "CHANGE",
          "explanation": "The book considers how movements change when their principles meet unequal power and public backlash.",
          "sourceIds": [
            "src-parable-talents"
          ],
          "experienceIdeas": [
            "Use table cards inviting guests to distinguish change from progress."
          ]
        }
      ],
      "copyright": {
        "status": "COPYRIGHTED",
        "mayStoreFullText": false,
        "rightsNote": "In-copyright work. Store bibliographic metadata and original commentary only; do not store full text or cover art without permission."
      },
      "isbns": {
        "isbn13": "9781888363814"
      },
      "externalIds": {
        "openLibraryWorkId": "OL35618W",
        "googleBooksVolumeId": "gOy07Z1AAR8C"
      },
      "links": [
        {
          "kind": "METADATA",
          "url": "https://openlibrary.org/works/OL35618W/Parable_of_the_Talents",
          "label": "Open Library record"
        }
      ],
      "sourceRefs": [
        {
          "sourceId": "src-parable-talents",
          "provider": "Open Library",
          "title": "Parable of the Talents by Octavia E. Butler",
          "url": "https://openlibrary.org/works/OL35618W/Parable_of_the_Talents",
          "accessedAt": "2026-08-31T17:44:24Z",
          "attribution": "Bibliographic and context source; summary and theme notes are original.",
          "licenseNote": "Do not assume the listing grants full-text or cover-image reuse rights."
        }
      ],
      "reviewStatus": "DRAFT"
    },
    {
      "id": "book-kindred",
      "title": "Kindred",
      "authors": [
        "Octavia E. Butler"
      ],
      "publicationYear": 1979,
      "summary": "Dana, a Black writer living in twentieth-century California, is repeatedly drawn into the early nineteenth-century Maryland plantation world connected to her family line. Butler uses time travel to confront slavery's violence and the intimate, long-lasting consequences of racial power.",
      "subjects": [
        "Historical fiction",
        "Speculative fiction",
        "African American fiction",
        "Slavery in fiction"
      ],
      "themes": [
        {
          "theme": "ANCESTRY",
          "explanation": "Family connection becomes a difficult route into the historical conditions that shape the present.",
          "sourceIds": [
            "src-kindred"
          ],
          "experienceIdeas": [
            "Offer an optional prompt about a food memory passed between generations."
          ]
        },
        {
          "theme": "RESILIENCE",
          "explanation": "The novel centers endurance while refusing to romanticize the conditions that make endurance necessary.",
          "sourceIds": [
            "src-kindred"
          ],
          "experienceIdeas": [
            "Frame discussion around care and survival rather than trauma spectacle."
          ]
        },
        {
          "theme": "CHANGE",
          "explanation": "By crossing time periods, the book asks how historical systems continue to influence contemporary relationships.",
          "sourceIds": [
            "src-kindred"
          ],
          "experienceIdeas": [
            "Share a short reflection on which traditions change and which remain meaningful."
          ]
        }
      ],
      "copyright": {
        "status": "COPYRIGHTED",
        "mayStoreFullText": false,
        "rightsNote": "In-copyright work. Store bibliographic metadata and original commentary only; do not store full text or cover art without permission."
      },
      "isbns": {
        "isbn13": "9780807083697"
      },
      "externalIds": {
        "openLibraryWorkId": "OL35616W",
        "googleBooksVolumeId": "89-2ZXYsuAQC"
      },
      "links": [
        {
          "kind": "METADATA",
          "url": "https://openlibrary.org/works/OL35616W/Kindred",
          "label": "Open Library record"
        }
      ],
      "sourceRefs": [
        {